{
  "$schema": "https://json-schema.org/draft/2020-12/schema",
  "$id": "https://heat-engine.spec/tier1/cascade-fixtures.schema.json",
  "title": "CascadeFixtureFile",
  "description": "JSON envelope for weather-cascade fixture files. Cascade is the only tier-1 module whose fixtures need JSON (vs. CSV) — the nested replay 'responses' array and tree-structured 'expectedAudit.children' don't serialize cleanly to CSV. Each file describes one cascade scenario as a single fixture row with mocked HTTP responses.",
  "type": "object",
  "required": ["spec_version", "module", "source_citations", "rows"],
  "additionalProperties": false,
  "properties": {
    "$schema": {
      "type": "string",
      "description": "Optional reference to this meta-schema; usually 'https://heat-engine.spec/tier1/cascade-fixtures.schema.json'."
    },
    "spec_version": {
      "type": "string",
      "pattern": "^\\d+\\.\\d+\\.\\d+$",
      "description": "Spec version this fixture is pinned to. Conformance tests assert this matches the runtime SPEC_VERSION."
    },
    "module": {
      "const": "cascade",
      "description": "Always 'cascade' for files under this schema."
    },
    "source_citations": {
      "type": "array",
      "items": { "type": "string" },
      "minItems": 1,
      "description": "Where this fixture's expected behavior comes from (e.g., 'api.weather.gov + api.open-meteo.com cascade order')."
    },
    "rows": {
      "type": "array",
      "minItems": 1,
      "items": { "$ref": "#/$defs/Row" },
      "description": "One or more fixture rows. Cascade replay scenarios typically have exactly one row per file."
    }
  },
  "$defs": {
    "Row": {
      "type": "object",
      "required": ["id", "description", "input", "ctx", "expectedResult", "expectedAudit"],
      "additionalProperties": false,
      "properties": {
        "id": {
          "type": "string",
          "minLength": 1,
          "description": "Stable identifier for this row, used in test names and CHANGELOG entries."
        },
        "description": {
          "type": "string",
          "description": "Human-readable summary of what this scenario exercises."
        },
        "input": {
          "type": "object",
          "required": ["lat", "lng"],
          "properties": {
            "lat": { "type": "number", "minimum": -90, "maximum": 90 },
            "lng": { "type": "number", "minimum": -180, "maximum": 180 },
            "isoTimestamp": { "type": "string" }
          },
          "additionalProperties": false,
          "description": "CascadeRequest payload."
        },
        "ctx": {
          "type": "object",
          "required": ["clock_iso", "responses"],
          "additionalProperties": false,
          "properties": {
            "clock_iso": {
              "type": "string",
              "pattern": "^[0-9]{4}-[0-9]{2}-[0-9]{2}T[0-9]{2}:[0-9]{2}:[0-9]{2}\\.[0-9]{3}Z$",
              "description": "Pinned clock the conformance test injects via SpecContext."
            },
            "responses": {
              "type": "array",
              "items": { "$ref": "#/$defs/Response" },
              "description": "Replay HTTP responses for the httpAdapter; matched in order against outgoing requests by url_pattern regex."
            }
          },
          "description": "Test-time context: clock + replay responses. The runtime adapter walks the responses list and serves the first url_pattern match."
        },
        "expectedResult": {
          "oneOf": [
            { "$ref": "#/$defs/CascadeResult" },
            { "type": "null" }
          ],
          "description": "Expected CascadeResult shape, or null if the cascade is expected to fail catastrophically (e.g., all sources timeout under a zero-budget ctx)."
        },
        "expectedAudit": {
          "$ref": "audit.schema.json",
          "description": "Expected AuditRecord byte-equal via canonicalJson. Tree-structured: children[] should mirror the source_chain."
        }
      }
    },
    "Response": {
      "type": "object",
      "required": ["url_pattern", "status"],
      "additionalProperties": false,
      "properties": {
        "url_pattern": {
          "type": "string",
          "minLength": 1,
          "description": "Regex matched against the outgoing request URL. First match wins."
        },
        "status": {
          "type": "integer",
          "minimum": 100,
          "maximum": 599,
          "description": "HTTP status code to return."
        },
        "body_json": {
          "description": "JSON-encodable response body. Mutually exclusive with body_text."
        },
        "body_text": {
          "type": "string",
          "description": "Raw response body (useful for malformed-JSON scenarios). Mutually exclusive with body_json."
        },
        "simulate": {
          "enum": ["timeout"],
          "description": "When set, the adapter simulates the named failure mode instead of returning a response."
        }
      }
    },
    "CascadeResult": {
      "type": "object",
      "required": ["sample"],
      "additionalProperties": false,
      "properties": {
        "sample": {
          "type": "object",
          "required": ["tempC", "rhPct", "source"],
          "additionalProperties": false,
          "properties": {
            "tempC": { "type": "number" },
            "rhPct": { "type": "number", "minimum": 0, "maximum": 100 },
            "windMps": { "type": "number", "minimum": 0 },
            "source": { "enum": ["nws", "open-meteo", "simulated"] }
          }
        }
      }
    }
  }
}
